[
  {
    "exposure_id": "EXP00000001",
    "customer_id": "C00000001",
    "campaign_id": "CMP2024_QR01",
    "eligible": true,
    "treatment": 1,
    "assignment_probability": 0.5,
    "assigned_at": "2024-02-01T00:00:00Z"
  },
  {
    "exposure_id": "EXP00000002",
    "customer_id": "C00000004",
    "campaign_id": "CMP2024_QR01",
    "eligible": true,
    "treatment": 0,
    "assignment_probability": 0.5,
    "assigned_at": "2024-02-01T00:00:00Z"
  },
  {
    "exposure_id": "EXP00000003",
    "customer_id": "C00000005",
    "campaign_id": "CMP2024_QR01",
    "eligible": true,
    "treatment": 1,
    "assignment_probability": 0.5,
    "assigned_at": "2024-02-01T00:00:00Z"
  },
  {
    "exposure_id": "EXP00000004",
    "customer_id": "C00000006",
    "campaign_id": "CMP2024_QR01",
    "eligible": true,
    "treatment": 0,
    "assignment_probability": 0.5,
    "assigned_at": "2024-02-01T00:00:00Z"
  },
  {
    "exposure_id": "EXP00000005",
    "customer_id": "C00000008",
    "campaign_id": "CMP2024_QR01",
    "eligible": true,
    "treatment": 1,
    "assignment_probability": 0.5,
    "assigned_at": "2024-02-01T00:00:00Z"
  },
  {
    "exposure_id": "EXP00000006",
    "customer_id": "C00000010",
    "campaign_id": "CMP2024_QR01",
    "eligible": true,
    "treatment": 1,
    "assignment_probability": 0.5,
    "assigned_at": "2024-02-01T00:00:00Z"
  },
  {
    "exposure_id": "EXP00000007",
    "customer_id": "C00000011",
    "campaign_id": "CMP2024_QR01",
    "eligible": true,
    "treatment": 1,
    "assignment_probability": 0.5,
    "assigned_at": "2024-02-01T00:00:00Z"
  },
  {
    "exposure_id": "EXP00000008",
    "customer_id": "C00000013",
    "campaign_id": "CMP2024_QR01",
    "eligible": true,
    "treatment": 0,
    "assignment_probability": 0.5,
    "assigned_at": "2024-02-01T00:00:00Z"
  },
  {
    "exposure_id": "EXP00000009",
    "customer_id": "C00000014",
    "campaign_id": "CMP2024_QR01",
    "eligible": true,
    "treatment": 1,
    "assignment_probability": 0.5,
    "assigned_at": "2024-02-01T00:00:00Z"
  },
  {
    "exposure_id": "EXP00000010",
    "customer_id": "C00000015",
    "campaign_id": "CMP2024_QR01",
    "eligible": true,
    "treatment": 1,
    "assignment_probability": 0.5,
    "assigned_at": "2024-02-01T00:00:00Z"
  },
  {
    "exposure_id": "EXP00000011",
    "customer_id": "C00000017",
    "campaign_id": "CMP2024_QR01",
    "eligible": true,
    "treatment": 1,
    "assignment_probability": 0.5,
    "assigned_at": "2024-02-01T00:00:00Z"
  },
  {
    "exposure_id": "EXP00000012",
    "customer_id": "C00000019",
    "campaign_id": "CMP2024_QR01",
    "eligible": true,
    "treatment": 0,
    "assignment_probability": 0.5,
    "assigned_at": "2024-02-01T00:00:00Z"
  },
  {
    "exposure_id": "EXP00000013",
    "customer_id": "C00000020",
    "campaign_id": "CMP2024_QR01",
    "eligible": true,
    "treatment": 0,
    "assignment_probability": 0.5,
    "assigned_at": "2024-02-01T00:00:00Z"
  },
  {
    "exposure_id": "EXP00000014",
    "customer_id": "C00000022",
    "campaign_id": "CMP2024_QR01",
    "eligible": true,
    "treatment": 1,
    "assignment_probability": 0.5,
    "assigned_at": "2024-02-01T00:00:00Z"
  },
  {
    "exposure_id": "EXP00000015",
    "customer_id": "C00000023",
    "campaign_id": "CMP2024_QR01",
    "eligible": true,
    "treatment": 0,
    "assignment_probability": 0.5,
    "assigned_at": "2024-02-01T00:00:00Z"
  },
  {
    "exposure_id": "EXP00000016",
    "customer_id": "C00000024",
    "campaign_id": "CMP2024_QR01",
    "eligible": true,
    "treatment": 1,
    "assignment_probability": 0.5,
    "assigned_at": "2024-02-01T00:00:00Z"
  },
  {
    "exposure_id": "EXP00000017",
    "customer_id": "C00000026",
    "campaign_id": "CMP2024_QR01",
    "eligible": true,
    "treatment": 1,
    "assignment_probability": 0.5,
    "assigned_at": "2024-02-01T00:00:00Z"
  },
  {
    "exposure_id": "EXP00000018",
    "customer_id": "C00000027",
    "campaign_id": "CMP2024_QR01",
    "eligible": true,
    "treatment": 1,
    "assignment_probability": 0.5,
    "assigned_at": "2024-02-01T00:00:00Z"
  },
  {
    "exposure_id": "EXP00000019",
    "customer_id": "C00000029",
    "campaign_id": "CMP2024_QR01",
    "eligible": true,
    "treatment": 0,
    "assignment_probability": 0.5,
    "assigned_at": "2024-02-01T00:00:00Z"
  },
  {
    "exposure_id": "EXP00000020",
    "customer_id": "C00000030",
    "campaign_id": "CMP2024_QR01",
    "eligible": true,
    "treatment": 0,
    "assignment_probability": 0.5,
    "assigned_at": "2024-02-01T00:00:00Z"
  },
  {
    "exposure_id": "EXP00000021",
    "customer_id": "C00000035",
    "campaign_id": "CMP2024_QR01",
    "eligible": true,
    "treatment": 1,
    "assignment_probability": 0.5,
    "assigned_at": "2024-02-01T00:00:00Z"
  },
  {
    "exposure_id": "EXP00000022",
    "customer_id": "C00000036",
    "campaign_id": "CMP2024_QR01",
    "eligible": true,
    "treatment": 1,
    "assignment_probability": 0.5,
    "assigned_at": "2024-02-01T00:00:00Z"
  },
  {
    "exposure_id": "EXP00000023",
    "customer_id": "C00000037",
    "campaign_id": "CMP2024_QR01",
    "eligible": true,
    "treatment": 0,
    "assignment_probability": 0.5,
    "assigned_at": "2024-02-01T00:00:00Z"
  },
  {
    "exposure_id": "EXP00000024",
    "customer_id": "C00000040",
    "campaign_id": "CMP2024_QR01",
    "eligible": true,
    "treatment": 1,
    "assignment_probability": 0.5,
    "assigned_at": "2024-02-01T00:00:00Z"
  },
  {
    "exposure_id": "EXP00000025",
    "customer_id": "C00000041",
    "campaign_id": "CMP2024_QR01",
    "eligible": true,
    "treatment": 0,
    "assignment_probability": 0.5,
    "assigned_at": "2024-02-01T00:00:00Z"
  },
  {
    "exposure_id": "EXP00000026",
    "customer_id": "C00000042",
    "campaign_id": "CMP2024_QR01",
    "eligible": true,
    "treatment": 1,
    "assignment_probability": 0.5,
    "assigned_at": "2024-02-01T00:00:00Z"
  },
  {
    "exposure_id": "EXP00000027",
    "customer_id": "C00000043",
    "campaign_id": "CMP2024_QR01",
    "eligible": true,
    "treatment": 1,
    "assignment_probability": 0.5,
    "assigned_at": "2024-02-01T00:00:00Z"
  },
  {
    "exposure_id": "EXP00000028",
    "customer_id": "C00000044",
    "campaign_id": "CMP2024_QR01",
    "eligible": true,
    "treatment": 0,
    "assignment_probability": 0.5,
    "assigned_at": "2024-02-01T00:00:00Z"
  },
  {
    "exposure_id": "EXP00000029",
    "customer_id": "C00000045",
    "campaign_id": "CMP2024_QR01",
    "eligible": true,
    "treatment": 0,
    "assignment_probability": 0.5,
    "assigned_at": "2024-02-01T00:00:00Z"
  },
  {
    "exposure_id": "EXP00000030",
    "customer_id": "C00000046",
    "campaign_id": "CMP2024_QR01",
    "eligible": true,
    "treatment": 0,
    "assignment_probability": 0.5,
    "assigned_at": "2024-02-01T00:00:00Z"
  },
  {
    "exposure_id": "EXP00000031",
    "customer_id": "C00000047",
    "campaign_id": "CMP2024_QR01",
    "eligible": true,
    "treatment": 0,
    "assignment_probability": 0.5,
    "assigned_at": "2024-02-01T00:00:00Z"
  },
  {
    "exposure_id": "EXP00000032",
    "customer_id": "C00000049",
    "campaign_id": "CMP2024_QR01",
    "eligible": true,
    "treatment": 1,
    "assignment_probability": 0.5,
    "assigned_at": "2024-02-01T00:00:00Z"
  },
  {
    "exposure_id": "EXP00000033",
    "customer_id": "C00000050",
    "campaign_id": "CMP2024_QR01",
    "eligible": true,
    "treatment": 0,
    "assignment_probability": 0.5,
    "assigned_at": "2024-02-01T00:00:00Z"
  },
  {
    "exposure_id": "EXP00000034",
    "customer_id": "C00000051",
    "campaign_id": "CMP2024_QR01",
    "eligible": true,
    "treatment": 0,
    "assignment_probability": 0.5,
    "assigned_at": "2024-02-01T00:00:00Z"
  },
  {
    "exposure_id": "EXP00000035",
    "customer_id": "C00000052",
    "campaign_id": "CMP2024_QR01",
    "eligible": true,
    "treatment": 0,
    "assignment_probability": 0.5,
    "assigned_at": "2024-02-01T00:00:00Z"
  },
  {
    "exposure_id": "EXP00000036",
    "customer_id": "C00000053",
    "campaign_id": "CMP2024_QR01",
    "eligible": true,
    "treatment": 1,
    "assignment_probability": 0.5,
    "assigned_at": "2024-02-01T00:00:00Z"
  },
  {
    "exposure_id": "EXP00000037",
    "customer_id": "C00000054",
    "campaign_id": "CMP2024_QR01",
    "eligible": true,
    "treatment": 0,
    "assignment_probability": 0.5,
    "assigned_at": "2024-02-01T00:00:00Z"
  },
  {
    "exposure_id": "EXP00000038",
    "customer_id": "C00000057",
    "campaign_id": "CMP2024_QR01",
    "eligible": true,
    "treatment": 0,
    "assignment_probability": 0.5,
    "assigned_at": "2024-02-01T00:00:00Z"
  },
  {
    "exposure_id": "EXP00000039",
    "customer_id": "C00000058",
    "campaign_id": "CMP2024_QR01",
    "eligible": true,
    "treatment": 0,
    "assignment_probability": 0.5,
    "assigned_at": "2024-02-01T00:00:00Z"
  },
  {
    "exposure_id": "EXP00000040",
    "customer_id": "C00000062",
    "campaign_id": "CMP2024_QR01",
    "eligible": true,
    "treatment": 0,
    "assignment_probability": 0.5,
    "assigned_at": "2024-02-01T00:00:00Z"
  },
  {
    "exposure_id": "EXP00000041",
    "customer_id": "C00000063",
    "campaign_id": "CMP2024_QR01",
    "eligible": true,
    "treatment": 1,
    "assignment_probability": 0.5,
    "assigned_at": "2024-02-01T00:00:00Z"
  },
  {
    "exposure_id": "EXP00000042",
    "customer_id": "C00000064",
    "campaign_id": "CMP2024_QR01",
    "eligible": true,
    "treatment": 1,
    "assignment_probability": 0.5,
    "assigned_at": "2024-02-01T00:00:00Z"
  },
  {
    "exposure_id": "EXP00000043",
    "customer_id": "C00000065",
    "campaign_id": "CMP2024_QR01",
    "eligible": true,
    "treatment": 0,
    "assignment_probability": 0.5,
    "assigned_at": "2024-02-01T00:00:00Z"
  },
  {
    "exposure_id": "EXP00000044",
    "customer_id": "C00000066",
    "campaign_id": "CMP2024_QR01",
    "eligible": true,
    "treatment": 1,